{
  "agent": "Final Independent Audit Agent",
  "agent_id": "final_independent_audit_agent",
  "can_mark_complete": false,
  "claim_boundary": "Sub-agent records are review aids. They do not replace formal acceptance artifacts, source-backed reviewer decisions, calibrated validation, or operational routing approval.",
  "decision": "Final Independent Audit Agent cannot accept gate final_audit; the current final-study readiness audit reports blockers.",
  "evidence": [
    "docs/final_study_audit.md",
    "data/manifests/final_audit_acceptance.json",
    "data/manifests/final_audit_decision_packet.csv",
    "data/manifests/final_audit_decision_manifest.json",
    "docs/final_audit_decision_packet.md",
    "docs/review_packets/final_audit.md"
  ],
  "gate_id": "final_audit",
  "generated_at": "2026-05-09T00:30:10+00:00",
  "record_type": "sub_agent_gate_review",
  "required_actions": [
    "After all pre-final gates are ready, write the independent prompt-to-artifact final audit.",
    "Create final_audit_acceptance.json only when gate lists and readiness counts match current evidence.",
    "create docs/final_study_audit.md after all other gates close",
    "create an explicit final-audit acceptance record only after prompt-to-artifact review confirms every final gate is closed",
    "resolve final-audit decision blockers before final-audit acceptance",
    "final-audit decision: pre-final gates remain blocked: pilot_region_accepted, cached_osm_input, graph_scale_strategy, data_provenance, parameter_evidence, rail_evidence, validation_package, sensitivity_analysis, full_experiment_output, manuscript_report_alignment, reproducibility",
    "final-audit decision: required formal acceptance artifacts are absent: data/manifests/pilot_acceptance.json, data/manifests/graph_scale_acceptance.json, data/manifests/provenance_acceptance.json, data/parameters/parameter_acceptance.csv, data/parameters/road_class_overrides.csv, data/manifests/validation_acceptance.json, data/manifests/sensitivity_acceptance.json, data/manifests/experiment_acceptance.json, data/manifests/manuscript_acceptance.json, data/manifests/reproducibility_acceptance.json, docs/final_study_audit.md, data/manifests/final_audit_acceptance.json",
    "final-audit decision: docs/final_study_audit.md is absent",
    "final-audit decision: data/manifests/final_audit_acceptance.json is absent",
    "review final-audit human-decision rows before final-audit acceptance",
    "all pre-final gates must be ready before final audit acceptance: pilot_region_accepted, cached_osm_input, graph_scale_strategy, data_provenance, parameter_evidence, rail_evidence, validation_package, sensitivity_analysis, full_experiment_output, manuscript_report_alignment, reproducibility"
  ],
  "review_packet_paths": [
    "data/manifests/final_audit_decision_packet.csv",
    "docs/review_packets/final_audit.md"
  ],
  "reviewed_inputs": [
    "docs/current_goal_completion_audit.md",
    "data/manifests/current_goal_completion_audit.json",
    "data/manifests/acceptance_orchestration_manifest.json",
    "data/manifests/formal_acceptance_evidence_matrix_manifest.json",
    "data/manifests/formal_acceptance_package_audit.json",
    "docs/final_audit_decision_packet.md",
    "data/manifests/final_audit_decision_manifest.json",
    "scripts/audit_final_study_readiness.py",
    "docs/final_study_audit.md",
    "data/manifests/final_audit_acceptance.json",
    "data/manifests/final_audit_decision_packet.csv"
  ],
  "risks": [
    "A final audit created before pre-final gate closure would launder incomplete evidence.",
    "Proxy signals such as tests or generated manifests are not enough for final completion.",
    "create docs/final_study_audit.md after all other gates close",
    "create an explicit final-audit acceptance record only after prompt-to-artifact review confirms every final gate is closed",
    "resolve final-audit decision blockers before final-audit acceptance",
    "final-audit decision: pre-final gates remain blocked: pilot_region_accepted, cached_osm_input, graph_scale_strategy, data_provenance, parameter_evidence, rail_evidence, validation_package, sensitivity_analysis, full_experiment_output, manuscript_report_alignment, reproducibility",
    "final-audit decision: required formal acceptance artifacts are absent: data/manifests/pilot_acceptance.json, data/manifests/graph_scale_acceptance.json, data/manifests/provenance_acceptance.json, data/parameters/parameter_acceptance.csv, data/parameters/road_class_overrides.csv, data/manifests/validation_acceptance.json, data/manifests/sensitivity_acceptance.json, data/manifests/experiment_acceptance.json, data/manifests/manuscript_acceptance.json, data/manifests/reproducibility_acceptance.json, docs/final_study_audit.md, data/manifests/final_audit_acceptance.json",
    "final-audit decision: docs/final_study_audit.md is absent",
    "final-audit decision: data/manifests/final_audit_acceptance.json is absent",
    "review final-audit human-decision rows before final-audit acceptance",
    "all pre-final gates must be ready before final audit acceptance: pilot_region_accepted, cached_osm_input, graph_scale_strategy, data_provenance, parameter_evidence, rail_evidence, validation_package, sensitivity_analysis, full_experiment_output, manuscript_report_alignment, reproducibility"
  ],
  "schema_version": 1,
  "source_paths": [
    "docs/current_goal_completion_audit.md",
    "data/manifests/current_goal_completion_audit.json",
    "data/manifests/acceptance_orchestration_manifest.json",
    "data/manifests/formal_acceptance_evidence_matrix.csv",
    "data/manifests/formal_acceptance_package_audit.json",
    "data/manifests/final_audit_decision_packet.csv",
    "data/manifests/final_audit_decision_manifest.json",
    "docs/final_study_audit.md",
    "data/manifests/final_audit_acceptance.json"
  ],
  "status": "blocked"
}
