{
  "agent": "Validation Benchmark Strategy Agent",
  "agent_id": "validation_benchmark_strategy_agent",
  "can_mark_complete": false,
  "claim_boundary": "Sub-agent records are review aids. They do not replace formal acceptance artifacts, source-backed reviewer decisions, calibrated validation, or operational routing approval.",
  "decision": "Validation Benchmark Strategy Agent cannot accept gate validation_package; the current final-study readiness audit reports blockers.",
  "evidence": [
    "data/manifests/validation_acceptance.json",
    "data/validation/validation_summary.md",
    "data/validation/external_route_benchmarks.csv",
    "data/validation/external_route_benchmarks_osrm.csv",
    "data/validation/osrm_route_benchmark_manifest.json",
    "data/validation/accessibility_loss.csv",
    "data/validation/accessibility_loss_summary.md",
    "data/validation/canonical_route_road_evidence_exposure.csv",
    "data/validation/canonical_route_road_evidence_exposure_manifest.json",
    "data/validation/validation_review_packet.csv",
    "data/validation/validation_review_manifest.json",
    "data/validation/validation_strategy_readiness_packet.csv",
    "data/validation/validation_strategy_readiness_manifest.json",
    "docs/validation_strategy_readiness_packet.md",
    "data/validation/validation_benchmark_readiness_packet.csv",
    "data/validation/validation_benchmark_readiness_manifest.json",
    "docs/validation_benchmark_readiness_packet.md",
    "data/validation/validation_benchmark_decision_packet.csv",
    "data/validation/validation_benchmark_decision_manifest.json",
    "docs/validation_benchmark_decision_packet.md",
    "scripts/run_plausibility_validation.py",
    "scripts/run_accessibility_loss_analysis.py",
    "scripts/write_route_road_evidence_exposure.py",
    "scripts/run_osrm_route_benchmark.py",
    "scripts/write_osrm_snapshot_manifest.py",
    "scripts/write_validation_benchmark_readiness_packet.py",
    "scripts/write_validation_benchmark_decision_packet.py",
    "scripts/write_validation_review_packet.py",
    "scripts/write_validation_strategy_readiness_packet.py",
    "docs/review_packets/validation_package.md"
  ],
  "gate_id": "validation_package",
  "generated_at": "2026-05-09T00:30:10+00:00",
  "record_type": "sub_agent_gate_review",
  "required_actions": [
    "Review validation thresholds, benchmark scope, snapshot pinning, and failure cases.",
    "Create validation_acceptance.json after benchmark-strategy review.",
    "create an explicit validation acceptance record after benchmark-strategy review",
    "resolve validation strategy-readiness blockers before validation acceptance",
    "validation strategy readiness: validation_acceptance.json is absent",
    "validation strategy readiness: route-level road evidence exposure remains weak until road evidence gates close",
    "review validation strategy-readiness human-decision items before validation acceptance",
    "resolve validation benchmark-decision blockers before validation acceptance",
    "validation benchmark decision: validation summary still declares scaffold or sanity scope",
    "validation benchmark decision: route-level road evidence exposure remains weak until road evidence gates close",
    "validation benchmark decision: data/manifests/validation_acceptance.json is absent",
    "review validation benchmark-decision human-decision items before validation acceptance",
    "revise validation summary from scaffold/sanity evidence to accepted publication-level validation scope after review"
  ],
  "review_packet_paths": [
    "data/validation/validation_review_packet.csv",
    "data/validation/validation_strategy_readiness_packet.csv",
    "data/validation/validation_benchmark_readiness_packet.csv",
    "data/validation/validation_benchmark_decision_packet.csv",
    "docs/review_packets/validation_package.md"
  ],
  "reviewed_inputs": [
    "docs/validation_review_packet.md",
    "docs/validation_strategy_readiness_packet.md",
    "docs/validation_benchmark_readiness_packet.md",
    "docs/validation_benchmark_decision_packet.md",
    "docs/osrm_route_benchmark_manifest.md",
    "data/validation/validation_review_manifest.json",
    "data/validation/validation_strategy_readiness_manifest.json",
    "data/validation/validation_benchmark_readiness_manifest.json",
    "data/validation/validation_benchmark_decision_manifest.json",
    "data/manifests/validation_acceptance.json",
    "data/validation/validation_summary.md",
    "data/validation/external_route_benchmarks.csv",
    "data/validation/external_route_benchmarks_osrm.csv",
    "data/validation/osrm_route_benchmark_manifest.json",
    "data/validation/accessibility_loss.csv",
    "data/validation/accessibility_loss_summary.md",
    "data/validation/canonical_route_road_evidence_exposure.csv",
    "data/validation/canonical_route_road_evidence_exposure_manifest.json",
    "data/validation/validation_review_packet.csv",
    "data/validation/validation_strategy_readiness_packet.csv",
    "data/validation/validation_benchmark_readiness_packet.csv",
    "data/validation/validation_benchmark_decision_packet.csv",
    "scripts/run_plausibility_validation.py",
    "scripts/run_accessibility_loss_analysis.py",
    "scripts/write_route_road_evidence_exposure.py",
    "scripts/run_osrm_route_benchmark.py",
    "scripts/write_osrm_snapshot_manifest.py",
    "scripts/write_validation_benchmark_readiness_packet.py",
    "scripts/write_validation_benchmark_decision_packet.py",
    "scripts/write_validation_review_packet.py",
    "scripts/write_validation_strategy_readiness_packet.py"
  ],
  "risks": [
    "Live or unpinned route benchmarks are not reproducible enough for final claims.",
    "Plausibility checks cannot prove operational accuracy.",
    "create an explicit validation acceptance record after benchmark-strategy review",
    "resolve validation strategy-readiness blockers before validation acceptance",
    "validation strategy readiness: validation_acceptance.json is absent",
    "validation strategy readiness: route-level road evidence exposure remains weak until road evidence gates close",
    "review validation strategy-readiness human-decision items before validation acceptance",
    "resolve validation benchmark-decision blockers before validation acceptance",
    "validation benchmark decision: validation summary still declares scaffold or sanity scope",
    "validation benchmark decision: route-level road evidence exposure remains weak until road evidence gates close",
    "validation benchmark decision: data/manifests/validation_acceptance.json is absent",
    "review validation benchmark-decision human-decision items before validation acceptance",
    "revise validation summary from scaffold/sanity evidence to accepted publication-level validation scope after review"
  ],
  "schema_version": 1,
  "source_paths": [
    "data/validation/validation_review_packet.csv",
    "data/validation/validation_strategy_readiness_packet.csv",
    "data/validation/validation_benchmark_readiness_packet.csv",
    "data/validation/validation_benchmark_decision_packet.csv",
    "data/validation/osrm_route_benchmark_manifest.json",
    "data/validation/accessibility_loss.csv",
    "data/validation/canonical_route_road_evidence_exposure.csv",
    "data/manifests/validation_acceptance.json"
  ],
  "status": "needs_human_review"
}
