{
  "agent": "Road / Rail / Parameter Evidence Agent",
  "agent_id": "road_rail_parameter_evidence_agent",
  "can_mark_complete": false,
  "claim_boundary": "Sub-agent records are review aids. They do not replace formal acceptance artifacts, source-backed reviewer decisions, calibrated validation, or operational routing approval.",
  "decision": "Road / Rail / Parameter Evidence Agent cannot accept gate rail_evidence; the current final-study readiness audit reports blockers.",
  "evidence": [
    "data/parameters/rail_service_evidence.csv",
    "data/parameters/rail_station_bindings.csv",
    "data/parameters/rail_evidence_review_packet.csv",
    "data/parameters/rail_evidence_review_manifest.json",
    "data/rail/rail_timing_source_request_packet.csv",
    "data/rail/rail_timing_source_request_manifest.json",
    "data/rail/rail_fetch_readiness_packet.csv",
    "data/rail/rail_fetch_readiness_manifest.json",
    "docs/rail_fetch_readiness_packet.md",
    "data/rail/rail_evidence_priority_packet.csv",
    "data/rail/rail_evidence_priority_manifest.json",
    "docs/rail_evidence_priority_packet.md",
    "scripts/audit_rail_evidence.py",
    "scripts/write_rail_evidence_review_packet.py",
    "scripts/write_rail_timing_source_request_packet.py",
    "scripts/write_rail_fetch_readiness_packet.py",
    "scripts/write_rail_evidence_priority_packet.py",
    "scripts/fetch_rail_timetable_cache.py",
    "scripts/derive_rail_headway_evidence.py",
    "scripts/derive_rail_service_evidence.py",
    "scripts/derive_rail_gtfs_evidence.py",
    "docs/rail_gtfs_cache_schema.md",
    "scripts/fetch_rail_shortest_path_cache.py",
    "scripts/derive_rail_shortest_path_evidence.py",
    "data/parameters/parameter_evidence_review_packet.csv",
    "data/parameters/parameter_source_readiness_packet.csv",
    "data/parameters/parameter_evidence_priority_packet.csv",
    "data/parameters/road_evidence_review_packet.csv",
    "data/road/road_source_readiness_packet.csv",
    "data/road/road_evidence_priority_packet.csv",
    "docs/review_packets/cached_osm_input.md",
    "docs/review_packets/parameter_evidence.md",
    "docs/review_packets/rail_evidence.md"
  ],
  "gate_id": "rail_evidence",
  "generated_at": "2026-05-08T15:14:36+00:00",
  "record_type": "sub_agent_gate_review",
  "required_actions": [
    "Replace weak road, rail, and parameter assumptions with source-backed evidence or explicit accepted overrides.",
    "Create road_class_overrides.csv and parameter_acceptance.csv only after review.",
    "rail service evidence: cache timetable, shortest-path, or GTFS-derived records",
    "rail service evidence: derive headway and travel time from the cached records",
    "rail fetch readiness: rail timing cache files are absent unless source_cache_present is true",
    "rail fetch readiness: API-key and reviewed-GTFS rows require external reviewer-provided inputs",
    "rail fetch readiness: this packet is readiness evidence only and cannot create rail_service_evidence.csv",
    "rail evidence priority: rail timing cache files are absent",
    "rail evidence priority: DATA_GO_KR_KEY or reviewed GTFS input is absent",
    "rail evidence priority: capacity and availability treatment still require human/source-backed decisions"
  ],
  "review_packet_paths": [
    "data/parameters/parameter_evidence_review_packet.csv",
    "data/parameters/parameter_source_readiness_packet.csv",
    "data/parameters/parameter_evidence_priority_packet.csv",
    "data/parameters/road_evidence_review_packet.csv",
    "data/road/road_source_readiness_packet.csv",
    "data/road/road_evidence_priority_packet.csv",
    "data/parameters/rail_evidence_review_packet.csv",
    "data/rail/rail_fetch_readiness_packet.csv",
    "data/rail/rail_evidence_priority_packet.csv",
    "docs/review_packets/cached_osm_input.md",
    "docs/review_packets/parameter_evidence.md",
    "docs/review_packets/rail_evidence.md"
  ],
  "reviewed_inputs": [
    "data/parameters/parameter_evidence_review_packet.csv",
    "data/parameters/parameter_evidence_source_request_packet.csv",
    "data/parameters/parameter_source_readiness_manifest.json",
    "data/parameters/parameter_evidence_priority_manifest.json",
    "data/parameters/road_evidence_review_packet.csv",
    "data/road/road_evidence_source_request_packet.csv",
    "data/road/road_source_readiness_manifest.json",
    "data/road/road_evidence_priority_manifest.json",
    "data/parameters/rail_evidence_review_packet.csv",
    "data/rail/rail_timing_source_request_packet.csv",
    "data/rail/rail_fetch_readiness_manifest.json",
    "data/rail/rail_evidence_priority_manifest.json",
    "data/parameters/rail_service_evidence.csv",
    "data/parameters/rail_station_bindings.csv",
    "data/parameters/rail_evidence_review_manifest.json",
    "data/rail/rail_timing_source_request_manifest.json",
    "data/rail/rail_fetch_readiness_packet.csv",
    "docs/rail_fetch_readiness_packet.md",
    "data/rail/rail_evidence_priority_packet.csv",
    "docs/rail_evidence_priority_packet.md",
    "scripts/audit_rail_evidence.py",
    "scripts/write_rail_evidence_review_packet.py",
    "scripts/write_rail_timing_source_request_packet.py",
    "scripts/write_rail_fetch_readiness_packet.py",
    "scripts/write_rail_evidence_priority_packet.py",
    "scripts/fetch_rail_timetable_cache.py",
    "scripts/derive_rail_headway_evidence.py",
    "scripts/derive_rail_service_evidence.py",
    "scripts/derive_rail_gtfs_evidence.py",
    "docs/rail_gtfs_cache_schema.md",
    "scripts/fetch_rail_shortest_path_cache.py",
    "scripts/derive_rail_shortest_path_evidence.py"
  ],
  "risks": [
    "Road capacity and speed fallbacks are proxy values.",
    "Rail timing and capacity evidence remains assumption or sensitivity-only in the scaffold.",
    "Weak core parameters can determine the policy winner.",
    "rail service evidence: cache timetable, shortest-path, or GTFS-derived records",
    "rail service evidence: derive headway and travel time from the cached records",
    "rail fetch readiness: rail timing cache files are absent unless source_cache_present is true",
    "rail fetch readiness: API-key and reviewed-GTFS rows require external reviewer-provided inputs",
    "rail fetch readiness: this packet is readiness evidence only and cannot create rail_service_evidence.csv",
    "rail evidence priority: rail timing cache files are absent",
    "rail evidence priority: DATA_GO_KR_KEY or reviewed GTFS input is absent",
    "rail evidence priority: capacity and availability treatment still require human/source-backed decisions"
  ],
  "schema_version": 1,
  "source_paths": [
    "data/parameters/parameter_sources.csv",
    "data/parameters/road_class_overrides_draft.csv",
    "data/parameters/rail_service_evidence.csv",
    "data/parameters/rail_station_bindings.csv",
    "data/parameters/parameter_source_readiness_packet.csv",
    "data/parameters/parameter_evidence_priority_packet.csv",
    "data/road/road_source_readiness_packet.csv",
    "data/road/road_evidence_priority_packet.csv",
    "data/rail/rail_fetch_readiness_packet.csv",
    "data/rail/rail_evidence_priority_packet.csv",
    "data/parameters/road_class_overrides.csv",
    "data/parameters/parameter_acceptance.csv"
  ],
  "status": "blocked"
}
