{
  "agent": "OSM / Source / License / Provenance Review Agent",
  "agent_id": "osm_source_license_provenance_review_agent",
  "can_mark_complete": false,
  "claim_boundary": "Sub-agent records are review aids. They do not replace formal acceptance artifacts, source-backed reviewer decisions, calibrated validation, or operational routing approval.",
  "decision": "OSM / Source / License / Provenance Review Agent cannot accept gate data_provenance; the current final-study readiness audit reports blockers.",
  "evidence": [
    "data/manifests/provenance_acceptance.json",
    "data/manifests/source_provenance_manifest.json",
    "data/manifests/source_license_review_packet.csv",
    "data/manifests/source_license_review_manifest.json",
    "data/manifests/source_url_review_packet.csv",
    "data/manifests/source_url_review_manifest.json",
    "data/manifests/source_url_remediation_packet.csv",
    "data/manifests/source_url_remediation_manifest.json",
    "data/manifests/source_provenance_priority_packet.csv",
    "data/manifests/source_provenance_priority_manifest.json",
    "data/manifests/source_context_cache_request_packet.csv",
    "data/manifests/source_context_cache_request_manifest.json",
    "data/manifests/source_context_cache_decision_packet.csv",
    "data/manifests/source_context_cache_decision_manifest.json",
    "data/manifests/reproducibility_manifest.json",
    "docs/source_license_review_packet.md",
    "docs/source_url_review_packet.md",
    "docs/source_url_remediation_packet.md",
    "docs/source_provenance_priority_packet.md",
    "docs/source_context_cache_request_packet.md",
    "docs/source_context_cache_decision_packet.md",
    "docs/reproducibility_package.md",
    "docs/pilot_region_data_card.md",
    "scripts/audit_source_provenance.py",
    "scripts/write_source_license_review_packet.py",
    "scripts/write_source_url_review_packet.py",
    "scripts/write_source_url_remediation_packet.py",
    "scripts/write_source_provenance_priority_packet.py",
    "scripts/write_source_context_cache_request_packet.py",
    "scripts/write_source_context_cache_decision_packet.py",
    "docs/review_packets/data_provenance.md"
  ],
  "gate_id": "data_provenance",
  "generated_at": "2026-05-08T18:42:05+00:00",
  "record_type": "sub_agent_gate_review",
  "required_actions": [
    "Review source URLs, licenses, attribution, local snapshots, privacy abstraction, and reproducibility scope.",
    "Create data/manifests/provenance_acceptance.json only after source-backed review.",
    "create an explicit provenance acceptance record after source, license, snapshot, privacy, and reproducibility review",
    "replace scaffold-only reproducibility manifest with accepted source/license/snapshot provenance",
    "source provenance priority: formal provenance acceptance record is absent",
    "source provenance priority: context-only public sources still need cached extracts or exclusion decisions",
    "source provenance priority: cached public snapshots still require license, attribution, snapshot, and reproducibility review",
    "source provenance priority: repository inputs still require human scope/privacy/reproducibility review",
    "source provenance priority: URL remediation rows still require reviewer confirmation",
    "source context cache request: context-only public sources still lack reviewed cached extracts or explicit exclusion decisions",
    "source context cache request: license, attribution, snapshot, and reproducibility review are still required for retained public sources",
    "source context cache request: formal provenance acceptance record is absent",
    "source context cache decision: formal provenance acceptance record is absent",
    "source context cache decision: cache/exclusion decisions are pending for context-only public sources",
    "source context cache decision: retained context sources still require license, attribution, snapshot, and reproducibility review",
    "source context cache decision: ktdb_public_transport_gtfs_context: no reviewed cache artifact or explicit exclusion decision is present",
    "source context cache decision: metro9_capacity_context: no reviewed cache artifact or explicit exclusion decision is present",
    "source context cache decision: seoul_shortest_path_api_context: no reviewed cache artifact or explicit exclusion decision is present",
    "source context cache decision: seoul_timetable_api_context: no reviewed cache artifact or explicit exclusion decision is present"
  ],
  "review_packet_paths": [
    "data/manifests/source_license_review_packet.csv",
    "data/manifests/source_url_review_packet.csv",
    "data/manifests/source_url_remediation_packet.csv",
    "data/manifests/source_provenance_priority_packet.csv",
    "data/manifests/source_context_cache_request_packet.csv",
    "data/manifests/source_context_cache_decision_packet.csv",
    "docs/review_packets/data_provenance.md"
  ],
  "reviewed_inputs": [
    "data/manifests/source_provenance_manifest.json",
    "data/manifests/source_license_review_manifest.json",
    "data/manifests/source_url_review_manifest.json",
    "data/manifests/source_url_remediation_manifest.json",
    "data/manifests/source_provenance_priority_manifest.json",
    "data/manifests/source_context_cache_request_manifest.json",
    "data/manifests/source_context_cache_decision_manifest.json",
    "data/manifests/reproducibility_manifest.json",
    "data/manifests/current_goal_completion_audit.json",
    "docs/reproducibility_package.md",
    "cloned_repo_manifest.md",
    "data/manifests/provenance_acceptance.json",
    "data/manifests/source_license_review_packet.csv",
    "data/manifests/source_url_review_packet.csv",
    "data/manifests/source_url_remediation_packet.csv",
    "data/manifests/source_provenance_priority_packet.csv",
    "data/manifests/source_context_cache_request_packet.csv",
    "data/manifests/source_context_cache_decision_packet.csv",
    "docs/source_license_review_packet.md",
    "docs/source_url_review_packet.md",
    "docs/source_url_remediation_packet.md",
    "docs/source_provenance_priority_packet.md",
    "docs/source_context_cache_request_packet.md",
    "docs/source_context_cache_decision_packet.md",
    "docs/pilot_region_data_card.md",
    "scripts/audit_source_provenance.py",
    "scripts/write_source_license_review_packet.py",
    "scripts/write_source_url_review_packet.py",
    "scripts/write_source_url_remediation_packet.py",
    "scripts/write_source_provenance_priority_packet.py",
    "scripts/write_source_context_cache_request_packet.py",
    "scripts/write_source_context_cache_decision_packet.py"
  ],
  "risks": [
    "License or attribution requirements may be incomplete.",
    "Scaffold reproducibility scope cannot support final calibrated claims.",
    "create an explicit provenance acceptance record after source, license, snapshot, privacy, and reproducibility review",
    "replace scaffold-only reproducibility manifest with accepted source/license/snapshot provenance",
    "source provenance priority: formal provenance acceptance record is absent",
    "source provenance priority: context-only public sources still need cached extracts or exclusion decisions",
    "source provenance priority: cached public snapshots still require license, attribution, snapshot, and reproducibility review",
    "source provenance priority: repository inputs still require human scope/privacy/reproducibility review",
    "source provenance priority: URL remediation rows still require reviewer confirmation",
    "source context cache request: context-only public sources still lack reviewed cached extracts or explicit exclusion decisions",
    "source context cache request: license, attribution, snapshot, and reproducibility review are still required for retained public sources",
    "source context cache request: formal provenance acceptance record is absent",
    "source context cache decision: formal provenance acceptance record is absent",
    "source context cache decision: cache/exclusion decisions are pending for context-only public sources",
    "source context cache decision: retained context sources still require license, attribution, snapshot, and reproducibility review",
    "source context cache decision: ktdb_public_transport_gtfs_context: no reviewed cache artifact or explicit exclusion decision is present",
    "source context cache decision: metro9_capacity_context: no reviewed cache artifact or explicit exclusion decision is present",
    "source context cache decision: seoul_shortest_path_api_context: no reviewed cache artifact or explicit exclusion decision is present",
    "source context cache decision: seoul_timetable_api_context: no reviewed cache artifact or explicit exclusion decision is present"
  ],
  "schema_version": 1,
  "source_paths": [
    "data/manifests/source_provenance_manifest.json",
    "data/manifests/source_license_review_packet.csv",
    "data/manifests/source_url_review_packet.csv",
    "data/manifests/source_url_remediation_packet.csv",
    "data/manifests/source_provenance_priority_packet.csv",
    "data/manifests/source_context_cache_request_packet.csv",
    "data/manifests/source_context_cache_decision_packet.csv",
    "data/manifests/reproducibility_manifest.json",
    "data/cache/pilot_region_road_manifest.json",
    "cloned_repo_manifest.md",
    "data/manifests/provenance_acceptance.json"
  ],
  "status": "blocked"
}
