{
  "agent": "Paper / Report Claim Alignment Agent",
  "agent_id": "paper_report_claim_alignment_agent",
  "can_mark_complete": false,
  "claim_boundary": "Sub-agent records are review aids. They do not replace formal acceptance artifacts, source-backed reviewer decisions, calibrated validation, or operational routing approval.",
  "decision": "Paper / Report Claim Alignment Agent cannot accept gate manuscript_report_alignment; the current final-study readiness audit reports blockers.",
  "evidence": [
    "data/manifests/manuscript_acceptance.json",
    "paper/paper_draft.md",
    "report_draft.md",
    "report.docx",
    "results/realworld_pilot/tables/figure_table_manifest.json",
    "data/manifests/figure_table_review_packet.csv",
    "data/manifests/figure_table_review_manifest.json",
    "docs/figure_table_review_packet.md",
    "data/manifests/claim_alignment_review_packet.csv",
    "data/manifests/claim_alignment_review_manifest.json",
    "docs/claim_alignment_review_packet.md",
    "data/manifests/manuscript_report_decision_packet.csv",
    "data/manifests/manuscript_report_decision_manifest.json",
    "docs/manuscript_report_decision_packet.md",
    "docs/review_packets/manuscript_report_alignment.md"
  ],
  "gate_id": "manuscript_report_alignment",
  "generated_at": "2026-05-10T08:28:03+00:00",
  "record_type": "sub_agent_gate_review",
  "required_actions": [
    "Revise or hold claims until all supporting evidence gates are accepted.",
    "Create manuscript_acceptance.json after claim-by-claim review.",
    "close evidence gates before final paper/report claims",
    "create an explicit manuscript/report acceptance record after evidence gates, figures, paper, report, and claim boundaries are reviewed",
    "revise figure/table claim boundary from scaffold to accepted study scope",
    "resolve figure/table review blockers before manuscript acceptance",
    "figure/table review: figure/table outputs depend on reduced analysis graph scope",
    "figure/table review: figure/table source outputs remain scaffold or not calibrated",
    "figure/table review: data/manifests/manuscript_acceptance.json is absent",
    "review figure/table human-review rows before manuscript acceptance",
    "review or revise claim-alignment overclaim candidates before manuscript acceptance",
    "claim alignment: formal manuscript/report acceptance record is absent",
    "claim alignment: claim-alignment rows are review aids and do not approve manuscript claims",
    "claim alignment: evidence gates remain blocked, so result claims cannot be accepted as final-study claims",
    "resolve manuscript/report decision blockers before manuscript acceptance",
    "manuscript/report decision: figure/table outputs depend on reduced analysis graph scope; figure/table source outputs remain scaffold or not calibrated; data/manifests/manuscript_acceptance.json is absent",
    "manuscript/report decision: claim-alignment packet has 91 rows requiring revision or acceptance",
    "manuscript/report decision: upstream evidence gates blocked: pilot_region_accepted, cached_osm_input, graph_scale_strategy, data_provenance, parameter_evidence, rail_evidence, validation_package, sensitivity_analysis, full_experiment_output",
    "manuscript/report decision: data/manifests/manuscript_acceptance.json is absent",
    "review manuscript/report human-decision rows before manuscript acceptance"
  ],
  "review_packet_paths": [
    "data/manifests/claim_alignment_review_packet.csv",
    "data/manifests/figure_table_review_packet.csv",
    "data/manifests/manuscript_report_decision_packet.csv",
    "docs/review_packets/manuscript_report_alignment.md"
  ],
  "reviewed_inputs": [
    "scripts/audit_publication_readiness.py",
    "docs/current_goal_completion_audit.md",
    "data/manifests/current_goal_completion_audit.json",
    "paper/paper_draft.md",
    "report_draft.md",
    "data/manifests/claim_alignment_review_manifest.json",
    "data/manifests/figure_table_review_manifest.json",
    "data/manifests/manuscript_report_decision_manifest.json",
    "docs/figure_table_review_packet.md",
    "docs/manuscript_report_decision_packet.md",
    "data/manifests/manuscript_acceptance.json",
    "report.docx",
    "results/realworld_pilot/tables/figure_table_manifest.json",
    "data/manifests/figure_table_review_packet.csv",
    "data/manifests/claim_alignment_review_packet.csv",
    "docs/claim_alignment_review_packet.md",
    "data/manifests/manuscript_report_decision_packet.csv"
  ],
  "risks": [
    "Paper/report can overstate scaffold results as calibrated real-world findings.",
    "Figures and tables can imply finality before evidence gates close.",
    "close evidence gates before final paper/report claims",
    "create an explicit manuscript/report acceptance record after evidence gates, figures, paper, report, and claim boundaries are reviewed",
    "revise figure/table claim boundary from scaffold to accepted study scope",
    "resolve figure/table review blockers before manuscript acceptance",
    "figure/table review: figure/table outputs depend on reduced analysis graph scope",
    "figure/table review: figure/table source outputs remain scaffold or not calibrated",
    "figure/table review: data/manifests/manuscript_acceptance.json is absent",
    "review figure/table human-review rows before manuscript acceptance",
    "review or revise claim-alignment overclaim candidates before manuscript acceptance",
    "claim alignment: formal manuscript/report acceptance record is absent",
    "claim alignment: claim-alignment rows are review aids and do not approve manuscript claims",
    "claim alignment: evidence gates remain blocked, so result claims cannot be accepted as final-study claims",
    "resolve manuscript/report decision blockers before manuscript acceptance",
    "manuscript/report decision: figure/table outputs depend on reduced analysis graph scope; figure/table source outputs remain scaffold or not calibrated; data/manifests/manuscript_acceptance.json is absent",
    "manuscript/report decision: claim-alignment packet has 91 rows requiring revision or acceptance",
    "manuscript/report decision: upstream evidence gates blocked: pilot_region_accepted, cached_osm_input, graph_scale_strategy, data_provenance, parameter_evidence, rail_evidence, validation_package, sensitivity_analysis, full_experiment_output",
    "manuscript/report decision: data/manifests/manuscript_acceptance.json is absent",
    "review manuscript/report human-decision rows before manuscript acceptance"
  ],
  "schema_version": 1,
  "source_paths": [
    "paper/paper_draft.md",
    "report_draft.md",
    "report.docx",
    "results/realworld_pilot/tables/figure_table_manifest.json",
    "data/manifests/claim_alignment_review_packet.csv",
    "data/manifests/figure_table_review_packet.csv",
    "data/manifests/manuscript_report_decision_packet.csv",
    "data/manifests/manuscript_acceptance.json"
  ],
  "status": "blocked"
}
